"Path","Slice Name","Alias(s)","Label","Min","Max","Must Support?","Is Modifier?","Is Summary?","Type(s)","Short","Definition","Comments","Requirements","Default Value","Meaning When Missing","Fixed Value","Pattern","Example","Minimum Value","Maximum Value","Maximum Length","Binding Strength","Binding Description","Binding Value Set","Code","Slicing Discriminator","Slicing Description","Slicing Ordered","Slicing Rules","Base Path","Base Min","Base Max","Condition(s)","Constraint(s)"
"shr-core-StageInformation-model","","","",0,*,"","","","","","The relative advancement in the course of a disease. The StageCode is the summary stage or stage group. StageDetail optionally contains the full staging information.","","","","","","","","","",,,,,"",,,,"shr-core-StageInformation-model",0,*,"",""
"shr-core-StageInformation-model.stageSummary","","","",0,1,"","","","Coding {[]} {[]}
","A code representing the current stage of a disease.","A code representing the current stage of a disease.","","","","","","","","","",,,,,"",,,,"shr-core-StageInformation-model.stageSummary",0,1,"",""
"shr-core-StageInformation-model.stageDetail","","","",0,1,"","","","Reference {[]} {[CanonicalType[http://hl7.org/fhir/us/shr/StructureDefinition/shr-core-Observation-model]]}
","The full staging information","The full staging information","","","","","","","","","",,,,,"",,,,"shr-core-StageInformation-model.stageDetail",0,1,"",""
