"Path","Slice Name","Alias(s)","Label","Min","Max","Must Support?","Is Modifier?","Is Summary?","Type(s)","Short","Definition","Comments","Requirements","Default Value","Meaning When Missing","Fixed Value","Pattern","Example","Minimum Value","Maximum Value","Maximum Length","Binding Strength","Binding Description","Binding Value Set","Code","Slicing Discriminator","Slicing Description","Slicing Ordered","Slicing Rules","Base Path","Base Min","Base Max","Condition(s)","Constraint(s)"
"shr-core-ContactDetail-model","","","",0,*,"","","","","","Describes an individual and how to reach them.","","","","","","","","","",,,,,"",,,,"shr-core-ContactDetail-model",0,*,"",""
"shr-core-ContactDetail-model.humanName","","","",0,1,"","","","http://hl7.org/fhir/us/odh/StructureDefinition/shr-core-HumanName-model {[]} {[]}
","A name used by a human being, written as it would be typically expressed. May include a breakdown of the various elements of the name (family name, given name, etc.).","A name used by a human being, written as it would be typically expressed. May include a breakdown of the various elements of the name (family name, given name, etc.).","","","","","","","","","",,,,,"",,,,"shr-core-ContactDetail-model.humanName",0,1,"",""
"shr-core-ContactDetail-model.contactPoint","","","",0,*,"","","","http://hl7.org/fhir/us/odh/StructureDefinition/shr-core-ContactPoint-model {[]} {[]}
","An electronic means of contacting an organization or individual.","An electronic means of contacting an organization or individual.","","","","","","","","","",,,,,"",,,,"shr-core-ContactDetail-model.contactPoint",0,*,"",""
