"Path","Slice Name","Alias(s)","Label","Min","Max","Must Support?","Is Modifier?","Is Summary?","Type(s)","Short","Definition","Comments","Requirements","Default Value","Meaning When Missing","Fixed Value","Pattern","Example","Minimum Value","Maximum Value","Maximum Length","Binding Strength","Binding Description","Binding Value Set","Code","Slicing Discriminator","Slicing Description","Slicing Ordered","Slicing Rules","Base Path","Base Min","Base Max","Condition(s)","Constraint(s)"
"shr-core-TimePeriod-model","","","",0,*,"","","","","","A period of time defined by a start and end time, date, or year.
If the start date/time is missing, the start of the period is not known. If the end date/time is missing, it means that the period is ongoing.","","","","","","","","","",,,,,"",,,,"shr-core-TimePeriod-model",0,*,"",""
"shr-core-TimePeriod-model.beginDateTime","","","",0,1,"","","","dateTime {[]} {[]}
","The time at which something is to take effect, start, or did start. Boundary is considered inclusive.","The time at which something is to take effect, start, or did start. Boundary is considered inclusive.","","","","","","","","","",,,,,"",,,,"shr-core-TimePeriod-model.beginDateTime",0,1,"",""
"shr-core-TimePeriod-model.endDateTime","","","",0,1,"","","","dateTime {[]} {[]}
","The time at which something is to end or did end. Boundary is considered inclusive.","The time at which something is to end or did end. Boundary is considered inclusive.","","","","","","","","","",,,,,"",,,,"shr-core-TimePeriod-model.endDateTime",0,1,"",""
